{
  "$schema": "https://json-schema.org/draft/2020-12/schema",
  "type": "object",
  "required": [
    "schema_version",
    "summary",
    "scope",
    "functional_requirements",
    "non_functional_requirements",
    "user_flows",
    "open_questions",
    "assumptions",
    "risks",
    "quality_gates",
    "traceability"
  ],
  "properties": {
    "schema_version": {
      "type": "string",
      "const": "1.0"
    },
    "summary": {
      "type": "string",
      "minLength": 1
    },
    "scope": {
      "type": "object",
      "required": [
        "in_scope",
        "out_of_scope"
      ],
      "properties": {
        "in_scope": {
          "type": "array",
          "items": {
            "type": "string",
            "minLength": 1
          },
          "minItems": 1
        },
        "out_of_scope": {
          "type": "array",
          "items": {
            "type": "string",
            "minLength": 1
          },
          "minItems": 0
        }
      },
      "additionalProperties": true
    },
    "functional_requirements": {
      "type": "array",
      "items": {
        "type": "object",
        "required": [
          "id",
          "statement",
          "priority",
          "acceptance_criteria"
        ],
        "properties": {
          "id": {
            "type": "string",
            "minLength": 1
          },
          "statement": {
            "type": "string",
            "minLength": 1
          },
          "priority": {
            "type": "string",
            "minLength": 1
          },
          "acceptance_criteria": {
            "type": "array",
            "items": {
              "type": "string",
              "minLength": 1
            },
            "minItems": 1
          }
        },
        "additionalProperties": true
      },
      "minItems": 1
    },
    "non_functional_requirements": {
      "type": "array",
      "items": {
        "type": "object",
        "required": [
          "id",
          "statement",
          "measure"
        ],
        "properties": {
          "id": {
            "type": "string",
            "minLength": 1
          },
          "statement": {
            "type": "string",
            "minLength": 1
          },
          "measure": {
            "type": "string",
            "minLength": 1
          }
        },
        "additionalProperties": true
      },
      "minItems": 1
    },
    "user_flows": {
      "type": "array",
      "items": {
        "type": "string",
        "minLength": 1
      },
      "minItems": 0
    },
    "traceability": {
      "type": "array",
      "items": {
        "type": "object",
        "required": [
          "from",
          "to",
          "relationship"
        ],
        "properties": {
          "from": {
            "type": "string",
            "minLength": 1
          },
          "to": {
            "type": "string",
            "minLength": 1
          },
          "relationship": {
            "type": "string",
            "minLength": 1
          }
        },
        "additionalProperties": true
      },
      "minItems": 1
    },
    "open_questions": {
      "type": "array",
      "items": {
        "type": "string",
        "minLength": 1
      },
      "minItems": 0
    },
    "assumptions": {
      "type": "array",
      "items": {
        "type": "string",
        "minLength": 1
      },
      "minItems": 0,
      "description": "Safe defaults or product assumptions made instead of blocking."
    },
    "risks": {
      "type": "array",
      "items": {
        "type": "object",
        "required": [
          "id",
          "risk",
          "impact",
          "mitigation"
        ],
        "properties": {
          "id": {
            "type": "string",
            "minLength": 1
          },
          "risk": {
            "type": "string",
            "minLength": 1
          },
          "impact": {
            "type": "string",
            "minLength": 1
          },
          "mitigation": {
            "type": "string",
            "minLength": 1
          }
        },
        "additionalProperties": true
      },
      "minItems": 0
    },
    "quality_gates": {
      "type": "array",
      "items": {
        "type": "object",
        "required": [
          "id",
          "gate",
          "evidence"
        ],
        "properties": {
          "id": {
            "type": "string",
            "minLength": 1
          },
          "gate": {
            "type": "string",
            "minLength": 1
          },
          "evidence": {
            "type": "string",
            "minLength": 1
          }
        },
        "additionalProperties": true
      },
      "minItems": 1
    },
    "verification_profile": {
      "enum": [
        "static-web",
        "javascript-web",
        "typescript-web"
      ],
      "description": "Required for web pipelines; fixed before implementation."
    },
    "browser_checks": {
      "type": "array",
      "minItems": 1,
      "maxItems": 40,
      "items": {
        "type": "object",
        "additionalProperties": false,
        "required": [
          "criterion_id",
          "actions",
          "assertions"
        ],
        "properties": {
          "criterion_id": {
            "type": "string",
            "minLength": 1,
            "maxLength": 200
          },
          "path": {
            "type": "string",
            "pattern": "^/[^:]*$",
            "maxLength": 500
          },
          "actions": {
            "type": "array",
            "maxItems": 20,
            "items": {
              "type": "object",
              "additionalProperties": false,
              "required": [
                "kind",
                "selector"
              ],
              "properties": {
                "kind": {
                  "enum": [
                    "click",
                    "fill",
                    "press",
                    "check",
                    "select"
                  ]
                },
                "selector": {
                  "type": "string",
                  "minLength": 1,
                  "maxLength": 500
                },
                "value": {
                  "type": "string",
                  "maxLength": 2000
                }
              }
            }
          },
          "assertions": {
            "type": "array",
            "minItems": 1,
            "maxItems": 20,
            "items": {
              "type": "object",
              "additionalProperties": false,
              "required": [
                "kind",
                "selector"
              ],
              "properties": {
                "kind": {
                  "enum": [
                    "visible",
                    "hidden",
                    "text",
                    "value",
                    "count"
                  ]
                },
                "selector": {
                  "type": "string",
                  "minLength": 1,
                  "maxLength": 500
                },
                "expected": {
                  "type": [
                    "string",
                    "integer"
                  ],
                  "maxLength": 2000
                }
              }
            }
          }
        }
      },
      "description": "Required for web pipelines: one host-run case per requirement acceptance item; IDs use REQ-ID/AC-01, AC-02, etc. Keep selectors part of the implementation contract."
    }
  },
  "additionalProperties": true,
  "title": "OpenAppForge requirements_spec"
}
