{
  "schema_version": "1.0",
  "summary": "Requirements for making AppForge-LLM v4 configure and use external LLM providers through a local llm_bridge service.",
  "scope": {
    "in_scope": [
      "Same-origin FastAPI /api/llm proxy endpoints for provider management and active model selection",
      "Vue provider settings UI launched from the current app header",
      "Local Bun/TypeScript llm_bridge service with provider registry, config persistence, testing, generation, and streaming endpoints",
      "llm-bridge AgentDriver and truthful JobManager readiness",
      "Tests and build verification for backend, frontend, and bridge"
    ],
    "out_of_scope": [
      "Hosted secret storage, team accounts, billing, deployment, OAuth, or production infrastructure",
      "Replacing Codex, Claude, generic, or auto driver behavior",
      "Guaranteeing live third-party provider success without credentials"
    ]
  },
  "functional_requirements": [
    {
      "id": "FR-001",
      "statement": "The web UI must let a user open LLM connection settings from the existing top bar.",
      "priority": "must",
      "acceptance_criteria": [
        "A visible LLM connection control exists in TopBar.vue.",
        "Activating the control renders ProviderSettings.vue as a modal/dialog.",
        "Closing the dialog returns to the existing app without clearing the current job or prompt state."
      ]
    },
    {
      "id": "FR-002",
      "statement": "The settings UI must list providers, accept API key/base URL/default model input, test a provider, delete stored keys, and activate a provider/model.",
      "priority": "must",
      "acceptance_criteria": [
        "The UI calls /api/llm/providers, /api/llm/providers/{id}/models, PUT/DELETE /api/llm/providers/{id}, POST /api/llm/providers/{id}/test, and GET/PUT /api/llm/active.",
        "Stored keys are never shown back to the user; placeholders only identify stored or environment-backed keys.",
        "Provider changes trigger a health refresh so readiness reflects the new state."
      ]
    },
    {
      "id": "FR-003",
      "statement": "The FastAPI app must proxy LLM provider management to the configured local bridge URL and return structured bridge errors.",
      "priority": "must",
      "acceptance_criteria": [
        "FastAPI exposes same-origin /api/llm endpoints that delegate to appforge.llm_bridge.",
        "BridgeError responses include code LLM_BRIDGE_ERROR, a user-facing message, and bridge context when available.",
        "Tests verify endpoint delegation parameters without live provider calls."
      ]
    },
    {
      "id": "FR-004",
      "statement": "APPFORGE_DRIVER=llm-bridge must be a supported driver/readiness path.",
      "priority": "must",
      "acceptance_criteria": [
        "create_driver accepts llm-bridge, llm_bridge, and llm aliases.",
        "JobManager.health reports llm-bridge ready only when the bridge is reachable and the selected provider is configured.",
        "Missing bridge, missing active provider, unknown provider, or unconfigured provider produce actionable setup messages."
      ]
    },
    {
      "id": "FR-005",
      "statement": "The local bridge service must provide provider registry/config/active-selection/test/generate/stream endpoints.",
      "priority": "must",
      "acceptance_criteria": [
        "llm_bridge/src/server.ts exposes health, providers, provider models, upsert/delete, test, active selection, generate, and stream routes.",
        "Unknown provider IDs are rejected for provider-specific routes and active selection.",
        "Provider configs are stored locally outside source-controlled files."
      ]
    }
  ],
  "non_functional_requirements": [
    {
      "id": "NFR-001",
      "statement": "Secrets must stay local and out of source control.",
      "measure": "No API keys appear in committed source, tests use fake values, .env patterns remain ignored, and the bridge config path is under APPFORGE_LLM_CONFIG/APPFORGE_LLM_CONFIG_DIR/APPFORGE_DATA_DIR or ~/.appforge/llm."
    },
    {
      "id": "NFR-002",
      "statement": "The integration must preserve existing web app and driver behavior.",
      "measure": "Existing Python suite passes and auto/codex/claude/generic branches remain available in create_driver and driver_readiness."
    },
    {
      "id": "NFR-003",
      "statement": "Frontend and bridge type contracts must be valid.",
      "measure": "npm run typecheck, npm run build, and bun run typecheck pass."
    },
    {
      "id": "NFR-004",
      "statement": "Dependency install must be reproducible from public npm for the frontend.",
      "measure": "frontend/package-lock.json uses registry.npmjs.org resolved URLs, matching public integrities for corrected packages, and frontend/.npmrc sets replace-registry-host=always."
    }
  ],
  "user_flows": [
    "User starts llm_bridge, opens AppForge-LLM v4, clicks LLM connection, saves provider credentials, tests the provider, activates a model, and sees health become ready for llm-bridge.",
    "User runs a job with APPFORGE_DRIVER=llm-bridge and the runner calls the active provider through bridge /generate.",
    "User has no bridge/provider configured and receives actionable setup guidance instead of a false-ready state."
  ],
  "open_questions": [],
  "assumptions": [
    "The bridge process is started separately from the FastAPI web process.",
    "Live provider calls require user credentials and are not exercised in automated tests.",
    "Single-shot bridge generation is acceptable for llm-bridge driver scope."
  ],
  "risks": [
    {
      "id": "R-001",
      "risk": "Readiness could claim llm-bridge is usable when no configured provider exists.",
      "impact": "Users start jobs that fail at the first stage.",
      "mitigation": "Readiness calls list_providers and checks the selected provider's configured flag."
    },
    {
      "id": "R-002",
      "risk": "Provider secrets could leak through UI or tests.",
      "impact": "Credential exposure.",
      "mitigation": "Do not return stored keys to the browser; tests use placeholder fake keys only."
    },
    {
      "id": "R-003",
      "risk": "Lockfile points to unreachable internal registry.",
      "impact": "Frontend verification and rebuilds fail.",
      "mitigation": "Normalize package-lock resolved URLs and add frontend/.npmrc replace-registry-host=always."
    }
  ],
  "quality_gates": [
    {
      "id": "QG-001",
      "gate": ".venv/bin/python -m pytest -q",
      "evidence": "Must pass the full backend/AppForge test suite."
    },
    {
      "id": "QG-002",
      "gate": "npm run typecheck and npm run build in frontend/",
      "evidence": "Must pass Vue type checking and production web asset build."
    },
    {
      "id": "QG-003",
      "gate": "bun run typecheck in llm_bridge/",
      "evidence": "Must pass TypeScript validation for bridge code."
    }
  ],
  "traceability": [
    {
      "from": "product_brief.desired_outcomes[0]",
      "to": "FR-001, FR-002",
      "relationship": "UI provider settings outcome"
    },
    {
      "from": "product_brief.desired_outcomes[1]",
      "to": "FR-003, FR-004",
      "relationship": "FastAPI proxy and readiness outcome"
    },
    {
      "from": "product_brief.desired_outcomes[2]",
      "to": "FR-004",
      "relationship": "Pipeline driver outcome"
    },
    {
      "from": "product_brief.desired_outcomes[3]",
      "to": "FR-005",
      "relationship": "Bridge endpoint outcome"
    }
  ]
}
